{
  "schemaVersion": "1.0.0",
  "taskId": "issue-924-style-src-attr-retirement",
  "workflowDir": "docs/30-workflows/completed-tasks/issue-924-style-src-attr-retirement",
  "evidence": [
    {
      "id": "focused-vitest-log",
      "kind": "test",
      "path": "outputs/phase-11/evidence/vitest-focused.log",
      "command": "pnpm exec vitest run focused style-src-attr retirement tests",
      "acquiredBy": "implementation_cycle",
      "requiredForCloseout": true,
      "notes": "Focused Vitest evidence log."
    },
    {
      "id": "playwright-security-headers-log",
      "kind": "test",
      "path": "outputs/phase-11/evidence/playwright-security-headers.log",
      "command": "pnpm exec playwright test security headers scenarios",
      "acquiredBy": "implementation_cycle",
      "requiredForCloseout": true,
      "notes": "Security headers Playwright evidence log."
    },
    {
      "id": "grep-gate-output",
      "kind": "grep-gate",
      "path": "outputs/phase-11/evidence/verify-no-inline-style.txt",
      "command": "pnpm verify:no-inline-style",
      "acquiredBy": "implementation_cycle",
      "requiredForCloseout": true,
      "notes": "Inline style retirement grep gate."
    },
    {
      "id": "visual-diff-report",
      "kind": "runtime-observation",
      "path": "outputs/phase-11/evidence/visual-diff-report.md",
      "command": "record visual diff report",
      "acquiredBy": "implementation_cycle",
      "requiredForCloseout": true,
      "notes": "Visual screenshot diff directory is summarized by this markdown evidence."
    },
    {
      "id": "staging-runtime-smoke",
      "kind": "runtime-observation",
      "path": "outputs/phase-11/evidence/staging-runtime-smoke.md",
      "command": "record staging runtime smoke boundary",
      "acquiredBy": "implementation_cycle",
      "requiredForCloseout": false,
      "notes": "Original manifest pointed at Phase 13; canonical Phase 11 manifest keeps a Phase 11-local text evidence path."
    }
  ]
}
